{
  "schema_version": "1.0",
  "framework": "gbp-journey",
  "audit_mode": "public",
  "rubric_version": "1.0.0",
  "rubric_title": "Google Business Profile Scorecard",
  "scorer_version": "1.0.0",
  "meta": {
    "run_id": "2026-10-26T1000-acme",
    "client": "Acme Plumbing (synthetic)",
    "trade": "plumbing",
    "market": "Example County, CA",
    "audit_mode": "public",
    "synthetic": true,
    "rubric_version": "1.0.0",
    "collector_version": "1.0.0",
    "started_at": "2026-10-26T10:00:00Z",
    "source_mode": "fixture",
    "place_id": "SYNTHETIC-PLACE-ACME-001",
    "website": "https://acme-plumbing.example/"
  },
  "sources": [
    {
      "id": "places",
      "type": "places_api",
      "collected_at": "2026-10-26T10:01:00Z",
      "collector_version": "1.0.0",
      "field_completeness": 82,
      "endpoint": "https://places.googleapis.com/v1/places/SYNTHETIC-PLACE-ACME-001"
    },
    {
      "id": "destination",
      "type": "destination_http",
      "collected_at": "2026-10-26T10:04:00Z",
      "collector_version": "1.0.0",
      "field_completeness": 76,
      "endpoint": "https://acme-plumbing.example/"
    },
    {
      "id": "public_profile",
      "type": "public_profile",
      "collected_at": "2026-10-26T10:06:00Z",
      "collector_version": "1.0.0",
      "field_completeness": 68,
      "endpoint": ""
    },
    {
      "id": "reviews",
      "type": "review_sample",
      "collected_at": "2026-10-26T10:07:00Z",
      "collector_version": "1.0.0",
      "field_completeness": 64,
      "endpoint": ""
    },
    {
      "id": "media",
      "type": "media_sample",
      "collected_at": "2026-10-26T10:08:00Z",
      "collector_version": "1.0.0",
      "field_completeness": 55,
      "endpoint": ""
    }
  ],
  "categories": [
    {
      "id": "A",
      "name": "Identity & Accuracy",
      "question": "Can a prospective customer confidently understand who this company is, where it operates, when it is available, and whether its public information is coherent?",
      "earned": 13,
      "max": 15,
      "applicable_max": 15,
      "normalized": 13.0,
      "normalized_before_cap": 13.0,
      "category_cap": null,
      "applicable": true,
      "na_checks": [],
      "percent": 86.7
    },
    {
      "id": "B",
      "name": "Relevance & Service Coverage",
      "question": "Does the profile accurately communicate the services the business wants local customers to hire it for?",
      "earned": 14,
      "max": 18,
      "applicable_max": 18,
      "normalized": 14.0,
      "normalized_before_cap": 14.0,
      "category_cap": null,
      "applicable": true,
      "na_checks": [],
      "percent": 77.8
    },
    {
      "id": "C",
      "name": "Conversion & Actionability",
      "question": "Can a ready-to-buy searcher take a useful next action with minimal friction?",
      "earned": 12,
      "max": 22,
      "applicable_max": 18,
      "normalized": 14.67,
      "normalized_before_cap": 14.67,
      "category_cap": null,
      "applicable": true,
      "na_checks": [
        "GBP-CON-04",
        "GBP-CON-05"
      ],
      "percent": 66.7
    },
    {
      "id": "D",
      "name": "Reputation & Trust",
      "question": "Does publicly observable reputation provide sufficient and current trust for a customer to act?",
      "earned": 12,
      "max": 20,
      "applicable_max": 20,
      "normalized": 12.0,
      "normalized_before_cap": 12.0,
      "category_cap": null,
      "applicable": true,
      "na_checks": [],
      "percent": 60.0
    },
    {
      "id": "E",
      "name": "Content & Freshness",
      "question": "Does the profile visibly demonstrate an active, credible company performing the work it claims to perform?",
      "earned": 5,
      "max": 10,
      "applicable_max": 9,
      "normalized": 5.56,
      "normalized_before_cap": 5.56,
      "category_cap": null,
      "applicable": true,
      "na_checks": [
        "GBP-CNT-06"
      ],
      "percent": 55.6
    },
    {
      "id": "F",
      "name": "Handoff & Journey Continuity",
      "question": "Does the customer journey remain coherent when the prospect leaves Google?",
      "earned": 6,
      "max": 10,
      "applicable_max": 8,
      "normalized": 7.5,
      "normalized_before_cap": 7.5,
      "category_cap": null,
      "applicable": true,
      "na_checks": [
        "GBP-HND-04"
      ],
      "percent": 75.0
    },
    {
      "id": "G",
      "name": "Measurement & Attribution",
      "question": "Can activity originating from the profile be meaningfully measured?",
      "earned": 1,
      "max": 5,
      "applicable_max": 3,
      "normalized": 1.67,
      "normalized_before_cap": 1.67,
      "category_cap": null,
      "applicable": true,
      "na_checks": [
        "GBP-MSR-02"
      ],
      "percent": 33.3
    }
  ],
  "checks": [
    {
      "id": "GBP-ID-01",
      "title": "Business status and identity",
      "category": "A",
      "stage": "identify",
      "max": 2,
      "score": 2,
      "applicable": true,
      "na_reason": "",
      "confidence": "verified",
      "evidence": [
        "Places API: businessStatus=OPERATIONAL; displayName=Acme Plumbing matches the destination title."
      ],
      "evidence_refs": [
        "places",
        "destination"
      ],
      "evaluation": "deterministic",
      "severity": "critical",
      "recommendedIntervention": "Confirm the profile status and legal trading name, then correct any mismatch.",
      "ownerData": false
    },
    {
      "id": "GBP-ID-02",
      "title": "Primary category fits the core business",
      "category": "A",
      "stage": "identify",
      "max": 2,
      "score": 2,
      "applicable": true,
      "na_reason": "",
      "confidence": "verified",
      "evidence": [
        "Places API primaryType=plumber; destination H1 names plumbing repair and drain service. The category is specific and accurate."
      ],
      "evidence_refs": [
        "places",
        "destination"
      ],
      "evaluation": "model_judgment",
      "severity": "high",
      "recommendedIntervention": "Choose the most specific accurate primary category for the core service.",
      "ownerData": false
    },
    {
      "id": "GBP-ID-03",
      "title": "Additional categories are relevant, not stuffed",
      "category": "A",
      "stage": "identify",
      "max": 2,
      "score": 1,
      "applicable": true,
      "na_reason": "",
      "confidence": "strong_signal",
      "evidence": [
        "Places API types include plumber, drainage service, and water heater repair. Drainage is supported by the site; water-heater evidence is thin, so the set is not fully supported."
      ],
      "evidence_refs": [
        "places",
        "destination"
      ],
      "evaluation": "model_judgment",
      "severity": "medium",
      "recommendedIntervention": "Remove unsupported categories and keep only services with real delivery evidence.",
      "ownerData": false
    },
    {
      "id": "GBP-ID-04",
      "title": "Primary phone is present and coherent",
      "category": "A",
      "stage": "identify",
      "max": 2,
      "score": 2,
      "applicable": true,
      "na_reason": "",
      "confidence": "verified",
      "evidence": [
        "Places API nationalPhoneNumber and destination tel: action both show (555) 010-0200."
      ],
      "evidence_refs": [
        "places",
        "destination"
      ],
      "evaluation": "deterministic",
      "severity": "critical",
      "recommendedIntervention": "Use one tracked or primary number and keep it consistent on the profile and site.",
      "ownerData": false
    },
    {
      "id": "GBP-ID-05",
      "title": "Website action is present and plausibly owned",
      "category": "A",
      "stage": "identify",
      "max": 2,
      "score": 2,
      "applicable": true,
      "na_reason": "",
      "confidence": "verified",
      "evidence": [
        "Places API websiteUri points to https://acme-plumbing.example/, the synthetic owned domain used throughout this fixture."
      ],
      "evidence_refs": [
        "places",
        "destination"
      ],
      "evaluation": "deterministic",
      "severity": "critical",
      "recommendedIntervention": "Point the profile at the business's own primary domain.",
      "ownerData": false
    },
    {
      "id": "GBP-ID-06",
      "title": "Location or service-area configuration is coherent",
      "category": "A",
      "stage": "understand",
      "max": 2,
      "score": 2,
      "applicable": true,
      "na_reason": "",
      "confidence": "verified",
      "evidence": [
        "Public profile and configuration: service-area business, no storefront address, Example County service area. The hidden address is correct, not a defect."
      ],
      "evidence_refs": [
        "public_profile",
        "places"
      ],
      "evaluation": "model_judgment",
      "severity": "high",
      "recommendedIntervention": "Make the location or service-area configuration match how the business actually sells.",
      "ownerData": false
    },
    {
      "id": "GBP-ID-07",
      "title": "Regular hours are present and coherent",
      "category": "A",
      "stage": "understand",
      "max": 1,
      "score": 1,
      "applicable": true,
      "na_reason": "",
      "confidence": "verified",
      "evidence": [
        "Places API regularOpeningHours: Mon-Sat 07:00-19:00. The destination publishes the same window."
      ],
      "evidence_refs": [
        "places",
        "destination"
      ],
      "evaluation": "deterministic",
      "severity": "high",
      "recommendedIntervention": "Publish accurate regular hours and mirror them on the site.",
      "ownerData": false
    },
    {
      "id": "GBP-ID-08",
      "title": "Description is specific and accurate",
      "category": "A",
      "stage": "understand",
      "max": 1,
      "score": 1,
      "applicable": true,
      "na_reason": "",